{
  "$comment": "SPDX-FileCopyrightText: Copyright (c) 2026 NVIDIA CORPORATION & AFFILIATES. All rights reserved.\nSPDX-License-Identifier: Apache-2.0",
  "$schema": "http://json-schema.org/draft-07/schema#",
  "title": "Usd Optimize Operation Catalog",
  "description": "Single source of truth for the Usd Optimize ops this skill pack documents. Merges the former operation-manifest.schema.json (op existence + routing-critical mechanics metadata) and operation-curation.schema.json (this-repo recommendation posture). Validation is hand-rolled in tests/operations/test_manifest_schema.py to keep the suite stdlib-only. Concept->op linkage is the FK validator-concepts.json.concepts[].backing_op -> operations[].key.",
  "type": "object",
  "required": ["operations"],
  "properties": {
    "$comment": { "type": "string" },
    "schema": {
      "type": "string",
      "description": "Historical identifier kept for compatibility (scene_optimizer_operation_catalog)."
    },
    "source": {
      "type": "string",
      "description": "Free-text note describing the catalog's role."
    },
    "operations": {
      "type": "array",
      "uniqueItems": true,
      "items": {
        "type": "object",
        "required": ["key", "curation"],
        "properties": {
          "key": {
            "type": "string",
            "pattern": "^[a-zA-Z][a-zA-Z0-9]*$",
            "description": "Canonical op key as registered in scene-optimizer-core."
          },
          "title": { "type": "string" },
          "category": { "type": "string" },
          "loss_class": {
            "type": "string",
            "enum": ["lossless", "bounded-loss", "analysis-only"]
          },
          "risk_class": {
            "type": "string",
            "enum": ["low", "medium", "high"]
          },
          "requires_confirmation": { "type": "boolean" },
          "apply_authority": {
            "type": "string",
            "enum": ["auto", "auto-within-tolerance", "intent-gated"],
            "description": "Machine-readable BASE/default apply-authority class for this op (the single source the prose references; conceptual model owned by usd-optimize-run-operations/references/operation-safety.md 'Apply authority'). 'auto' = lossless / always-safe, runs unattended. 'auto-within-tolerance' = bounded-loss op with a deviation parameter the plan runs by default at the conservative per-target band (runs with a notice). 'intent-gated' = identity-losing / above-band / destructive, always presented for an explicit decision. This static field is the BASE class ONLY: it is subject to the target-conditional functional-tolerance downgrade (auto-within-tolerance -> intent-gated on functional-precision / above-band targets) described in operation-safety.md, which is intentionally NOT encoded here. Cross-check: requires_confirmation == (apply_authority != 'auto')."
          },
          "args_count": { "type": "integer", "minimum": 0 },
          "requires_mesh": { "type": "boolean" },
          "pipelines": {
            "type": "array",
            "items": { "type": "string" }
          },
          "keywords": {
            "type": "array",
            "items": { "type": "string" }
          },
          "source": { "type": "string" },
          "summary": { "type": "string" },
          "since_version": {
            "type": "string",
            "format": "date-time",
            "description": "Optional provenance: ISO 8601 UTC date the op first appeared in scene-optimizer-core. Documentary only — no tool reads it; demoted from required so it is not mandatory output. When present it must still be a valid ISO 8601 UTC date-time (checked in tests)."
          },
          "curation": {
            "type": "object",
            "description": "This-repo recommendation posture (was _curation.json). status is now DERIVED by the upstream status-derivation rubric (run during skill development) and materialized here; only status_override + rationale are authored.",
            "required": ["status", "wired_into"],
            "additionalProperties": false,
            "properties": {
              "status": {
                "type": "string",
                "enum": ["canonical", "specialty", "analysis", "documentary", "deprecated"],
                "description": "GENERATED + materialized: must equal the rubric-derived status (override wins, else the rule result). Regenerated by the upstream coverage audit during skill development."
              },
              "status_override": {
                "type": "string",
                "enum": ["specialty", "deprecated"],
                "description": "Authored override for the two statuses the data cannot express: 'deprecated' (needs the named replacement) and 'specialty' (S2 narrow-workflow). When present, status must equal it and rationale is required."
              },
              "rationale": {
                "type": "string",
                "description": "Allowed ONLY on override entries (status_override present); carries the non-derivable info (named replacement / narrow workflow). Must start with '<status>:' (enforced in tests/audit)."
              },
              "wired_into": {
                "type": "array",
                "items": { "type": "string" },
                "description": "Authored evidence: repo paths that route/recommend this op. Non-empty when status is canonical; one of the reference-evidence inputs to the derivation."
              }
            }
          },
          "parameter_prerequisites": {
            "description": "Optional per-op preflight/elicitation contract migrated from per-op .md frontmatter. Shape is op-specific (array of field/elicit entries, or a structured object) and intentionally unconstrained.",
            "type": ["array", "object"]
          },
          "recommendation_signals": {
            "type": "array",
            "description": "Optional evidence signals that recommend this op."
          },
          "anti_patterns": {
            "type": "array",
            "items": { "type": "string" },
            "description": "Optional framing/anti-pattern guidance for this op."
          },
          "notes": {
            "type": "string",
            "description": "Optional free-text guidance migrated from a per-op .md body."
          }
        }
      }
    }
  }
}
