{
  "$comment": "SPDX-FileCopyrightText: Copyright (c) 2026 NVIDIA CORPORATION & AFFILIATES. All rights reserved.\nSPDX-License-Identifier: Apache-2.0",
  "schema": "scene_optimizer_operation_catalog",
  "source": "Usd Optimize operation catalog; single source of truth for op existence, routing metadata (manifest fields), and this-repo curation (status/rationale/wired_into). Replaces the former manifest.json + _curation.json + per-op <key>.md split.",
  "operations": [
    {
      "key": "boxClip",
      "title": "Box Clip",
      "category": "transform",
      "loss_class": "bounded-loss",
      "risk_class": "high",
      "requires_confirmation": true,
      "apply_authority": "intent-gated",
      "args_count": 13,
      "requires_mesh": false,
      "pipelines": [],
      "keywords": [
        "clip",
        "bounding-box",
        "aabb",
        "trim",
        "crop"
      ],
      "source": "scene-optimizer-core/source/operations/boxClip/BoxClip.cpp",
      "summary": "Box Clip removes or retains geometry based on an axis-aligned bounding box (AABB) region.",
      "since_version": "2026-02-11T07:51:19Z",
      "curation": {
        "status": "documentary",
        "wired_into": []
      }
    },
    {
      "key": "computeExtents",
      "title": "Compute Extents",
      "category": "metadata",
      "loss_class": "lossless",
      "risk_class": "low",
      "requires_confirmation": false,
      "apply_authority": "auto",
      "args_count": 1,
      "requires_mesh": true,
      "pipelines": [
        "safe-cleanup",
        "load-time-reduction",
        "data-quality-baseline"
      ],
      "keywords": [
        "extent",
        "bounding-box",
        "metadata",
        "culling"
      ],
      "source": "scene-optimizer-core/source/operations/computeExtents/ComputeExtentsPlugin.cpp",
      "summary": "Compute Extents calculates and authors the `extent` attribute for meshes.",
      "since_version": "2026-02-11T07:51:19Z",
      "curation": {
        "status": "canonical",
        "wired_into": [
          "skills/omniverse-usd-performance-tuning/references/usd-optimize-run-operations/references/operation-safety.md",
          "skills/omniverse-usd-performance-tuning/references/usd-optimize-run-operations/references/pipelines.md"
        ]
      }
    },
    {
      "key": "countVertices",
      "title": "Count Vertices",
      "category": "analysis",
      "loss_class": "analysis-only",
      "risk_class": "low",
      "requires_confirmation": false,
      "apply_authority": "auto",
      "args_count": 3,
      "requires_mesh": true,
      "pipelines": [],
      "keywords": [
        "count",
        "vertices",
        "stats",
        "analysis"
      ],
      "source": "scene-optimizer-core/source/operations/countVertices/CountVertices.cpp",
      "summary": "Count Vertices is a hidden analysis utility that categorizes meshes by vertex count into high, very high, and extreme buckets.",
      "since_version": "2026-02-11T07:51:19Z",
      "curation": {
        "status": "analysis",
        "wired_into": []
      }
    },
    {
      "key": "decimateMeshes",
      "title": "Decimate Meshes",
      "category": "geometry",
      "loss_class": "bounded-loss",
      "risk_class": "medium",
      "requires_confirmation": true,
      "apply_authority": "auto-within-tolerance",
      "args_count": 8,
      "requires_mesh": true,
      "pipelines": [
        "mesh-count-reduction"
      ],
      "keywords": [
        "decimate",
        "polygon-count",
        "lod",
        "qem",
        "silhouette"
      ],
      "source": "scene-optimizer-core/source/operations/decimateMeshes/OmniMeshDecimate.cpp",
      "summary": "Decimate Meshes reduces polygon count while preserving mesh shape as much as possible.",
      "since_version": "2026-02-11T07:51:19Z",
      "curation": {
        "status": "canonical",
        "wired_into": [
          "skills/omniverse-usd-performance-tuning/references/usd-optimize-run-operations/references/operation-safety.md",
          "skills/omniverse-usd-performance-tuning/references/usd-optimize-run-operations/references/pipelines.md",
          "skills/omniverse-usd-performance-tuning/references/workflow.md"
        ]
      },
      "parameter_prerequisites": [
        {
          "field": "asset_physical_context.metersPerUnit",
          "source": "sa_report.json",
          "required": true
        },
        {
          "elicit_from_user": "mm_tolerance",
          "canonical_question": "What's the smallest surface detail (in mm) you need to preserve?",
          "defaults": [
            0.1,
            0.5,
            1.0,
            2.0,
            5.0
          ],
          "skip_option": "skip decimation",
          "conversion": "maxMeanError = mm_tolerance / (metersPerUnit * 1000)"
        }
      ],
      "recommendation_signals": [
        {
          "source": "SceneOptimizerMeshDensityChecker",
          "signal": "High-density outlier meshes detected — meshes with triangle density disproportionate to their physical extent are strong candidates for decimation. This Phase-2c validator reads actual geometry and is the canonical over-tessellation signal (SA does not flag density; it reads no geometry arrays)."
        },
        {
          "note": "maxMeanError is inherently scale-aware: over-tessellated meshes (e.g. a 1M-poly screw at 20mm) lose most triangles because nearly all vertices fall within the error budget. Under-tessellated meshes barely change. No per-mesh targeting is needed — apply uniformly to all meshes."
        }
      ],
      "anti_patterns": [
        "Do not frame as 'reduce by X%'. Rate-mode bypasses the silhouette-preserving error budget.",
        "Do not ask which meshes to target. maxMeanError handles density differences automatically.",
        "Do not offer triangle-count or percentage options unless the user explicitly provides a rate-based constraint."
      ]
    },
    {
      "key": "deduplicateGeometry",
      "title": "De-duplicate Geometry",
      "category": "geometry",
      "loss_class": "lossless",
      "risk_class": "low",
      "requires_confirmation": false,
      "apply_authority": "auto",
      "args_count": 12,
      "requires_mesh": true,
      "pipelines": [
        "safe-cleanup",
        "memory-reduction",
        "mesh-count-reduction"
      ],
      "keywords": [
        "dedup",
        "instancing",
        "memory",
        "mesh"
      ],
      "source": "scene-optimizer-core/source/operations/deduplicateGeometry/DeduplicateGeometry.cpp",
      "summary": "De-duplicate Geometry finds meshes that are geometrically identical (or near-identical) and replaces duplicates with instances of a single prototype.",
      "since_version": "2026-02-11T07:51:19Z",
      "curation": {
        "status": "canonical",
        "wired_into": [
          "skills/omniverse-usd-performance-tuning/references/usd-optimize-run-operations/references/operation-safety.md",
          "skills/omniverse-usd-performance-tuning/references/usd-optimize-run-operations/references/pipelines.md",
          "skills/omniverse-usd-performance-tuning/references/workflow.md"
        ]
      },
      "anti_patterns": [
        "Do not set `tolerance: 0` to force exact matching. The argument is documented as \"use 0 to require exact matches\", but measured on a 41,900-mesh library it finds zero duplicate sets and emits a file byte-identical to its input. Leave the 0.001 default, or pass a small non-zero value and constrain matching with `considerDeepTransforms` instead.",
        "Do not pass boolean literals to this operation. The CLI parses these arguments as integers and rejects `considerDeepTransforms=false` with `failed to set argument: stoi`, aborting the run; use `0` or `1`.",
        "Do not read a large prototype count as evidence that sharing is finished. Measured on an already-instanced Revit MEP export with 37,435 prototypes, the default run still replaced 25,909 of 41,900 authored meshes (61.8%) losslessly."
      ]
    },
    {
      "key": "deduplicateHierarchies",
      "title": "De-duplicate Hierarchies",
      "category": "hierarchy",
      "loss_class": "lossless",
      "risk_class": "medium",
      "requires_confirmation": true,
      "apply_authority": "intent-gated",
      "args_count": 4,
      "requires_mesh": false,
      "pipelines": [
        "memory-reduction",
        "mesh-count-reduction",
        "instancing"
      ],
      "keywords": [
        "dedup",
        "instancing",
        "hierarchy",
        "prototype",
        "reference"
      ],
      "source": "scene-optimizer-core/source/operations/deduplicateHierarchies/DeduplicateHierarchies.cpp",
      "summary": "De-duplicate Hierarchies identifies structurally-identical sub-hierarchies and collapses them into shared prototypes with instanceable references at each original site.",
      "since_version": "2026-04-17T00:00:00Z",
      "curation": {
        "status": "canonical",
        "wired_into": [
          "skills/omniverse-usd-performance-tuning/references/usd-structure-assessment/references/restructure-decision/README.md",
          "skills/omniverse-usd-performance-tuning/references/usd-optimize-run-operations/references/operation-safety.md",
          "skills/omniverse-usd-performance-tuning/references/workflow.md"
        ]
      },